{
  "schemaVersion": 1,
  "migration": "20260721203929_admin_publication_outbox_claim_org_scope.sql",
  "taskId": "PUB-101",
  "status": "planned",
  "owner": "admin-platform",
  "reviewer": "security-data",
  "domains": ["publication", "tenancy"],
  "riskLevel": "high",
  "representativeSnapshot": { "kind": "isolated production-like Supabase branch", "evidenceArtifact": null },
  "preflight": { "rowCountQueries": ["outbox rows and null org_id grouped by state"], "expectedAffectedRows": "Function replacement only; zero persisted rows changed", "artifact": null },
  "execution": { "lockBudgetMs": 5000, "statementTimeoutMs": 60000, "batchSize": 0, "resumeStrategy": "Transactional CREATE OR REPLACE FUNCTION; retry the same migration after interruption", "resumeCursor": "supabase migration version 20260721203929", "idempotency": "CREATE OR REPLACE produces the same org-scoped claim function" },
  "quarantine": { "required": false, "table": null, "strategy": "No data backfill; fail validation if existing outbox ownership is unresolved" },
  "constraintsAndIndexes": { "constraints": [], "indexes": [], "validationPlan": "Confirm function signature, search_path, grants, and two-org claim isolation" },
  "recovery": { "rollback": "Do not roll back by deleting data; replace the function with the last reviewed definition", "forwardFix": "Ship a later CREATE OR REPLACE migration preserving rows and claims" },
  "postflight": { "queries": ["function definition/grants and two-org outbox claim matrix"], "artifact": null, "securityAdvisorArtifact": null, "performanceAdvisorArtifact": null },
  "verificationOwner": "release-engineering",
  "evidence": { "isolated": null, "staging": null, "production": null },
  "exceptions": []
}
