{
  "schemaVersion": 1,
  "migration": "20260823080000_contact_reconciliation.sql",
  "taskId": "REL-102",
  "status": "planned",
  "owner": "database-engineering",
  "reviewer": "security-data",
  "domains": [
    "contact"
  ],
  "riskLevel": "medium",
  "representativeSnapshot": {
    "kind": "isolated production-like Supabase branch required before promotion",
    "evidenceArtifact": null
  },
  "preflight": {
    "rowCountQueries": [
      "select count(*) from public.venue_profiles",
      "select count(*) from public.venue_profiles where contact_info is not null and jsonb_strip_nulls(contact_info) <> '{}'::jsonb",
      "select venue_id, count(*) from public.venue_contacts group by venue_id order by venue_id"
    ],
    "expectedAffectedRows": "Creates the missing canonical contact relation when absent and inserts at most one primary booking contact per venue_profiles.id from non-empty contact_info; existing contacts and source JSON remain unchanged",
    "artifact": null
  },
  "execution": {
    "lockBudgetMs": 5000,
    "statementTimeoutMs": 60000,
    "batchSize": 0,
    "resumeStrategy": "Transactional re-issue or an additive forward-fix after isolated rehearsal",
    "resumeCursor": "Supabase migration version 20260823080000",
    "idempotency": "Foundation objects use IF NOT EXISTS, the RLS policy is replaced deterministically, a partial unique index enforces one primary booking contact per venue, and the backfill skips existing rows"
  },
  "quarantine": {
    "required": false,
    "table": null,
    "strategy": "Do not infer tenant ownership; stop and quarantine unresolved rows before any backfill"
  },
  "constraintsAndIndexes": {
    "constraints": [
      "venue_contacts.id primary key",
      "venue_contacts.venue_id references the canonical venue_profiles(id) identity with cascade delete",
      "RLS permits authenticated access only through venue_has_operator_access and exposes no anonymous policy"
    ],
    "indexes": [
      "idx_venue_contacts_venue",
      "idx_venue_contacts_primary_booking"
    ],
    "validationPlan": "Fresh-chain rehearsal, an owner/non-owner/anonymous RLS matrix, canonical-FK inspection, source-to-contact counts, and a second execution with zero new inserts"
  },
  "recovery": {
    "rollback": "Prefer flag-off rollback; use an additive compensating migration for persisted schema changes",
    "forwardFix": "Ship a later additive migration after preserving unresolved records and evidence"
  },
  "postflight": {
    "queries": [
      "Read-only object, row-count, RLS, grant, constraint, and advisor checks must be captured"
    ],
    "artifact": null,
    "securityAdvisorArtifact": null,
    "performanceAdvisorArtifact": null
  },
  "verificationOwner": "security-data",
  "evidence": {
    "isolated": null,
    "staging": null,
    "production": null
  },
  "exceptions": []
}
